{
  "schema_version": 1,
  "configured": true,
  "context": {
    "country": "FR",
    "role": "guest",
    "currency": "EUR",
    "currency_minor_unit": 2,
    "prices_include_tax": true
  },
  "products": [
    {
      "ref": "cafe-decouverte",
      "variant": "250g-grains",
      "unit_price": 9980000,
      "price_precision": 6,
      "tax_class": "coffee-reduced",
      "settings": {
        "tax_rate_percent": "5.5",
        "sold_individually": true,
        "max_quantity": 1,
        "name": "Café Découverte — 250g / Café en grains (non moulu)",
        "native_id": 10
      }
    },
    {
      "ref": "spatules",
      "unit_price": 1500000,
      "price_precision": 6,
      "tax_class": "standard",
      "settings": {
        "tax_rate_percent": "20",
        "sold_individually": false,
        "max_quantity": 2,
        "name": "Paquet de 50 spatules",
        "native_id": 11
      }
    }
  ],
  "coupons": [
    {
      "code": "decouverte10",
      "type": "percent",
      "amount": "10",
      "settings": {
        "eligible_ref": "cafe-decouverte",
        "individual_use": false
      }
    }
  ],
  "settings": {
    "model": "woo-percent-v1",
    "sequential_discounts": false,
    "round_tax_at_subtotal": false
  }
}
